{
  "config": {
    "length": "auto_by_fact_density",
    "mode": "material_heavy_full_mode"
  },
  "inputs": {
    "deduplicated_items": "../aihot/deduplicated_items.json",
    "topic": "AI智能体正在重写网络安全攻防"
  },
  "network_mode": "live",
  "run_id": "20260731T135947-ai-bbg4al",
  "skill_name": "super-writer",
  "stage": "super_writer"
}