{
  "config": {
    "BODY_IMAGES_MIN": 6,
    "BODY_IMAGES_TARGET": 8,
    "COPYRIGHT_POLICY": "ALLOW_UNLESS_EXPLICITLY_PROHIBITED",
    "USER_BLANKET_APPROVAL": true,
    "manifest_single_writer": true,
    "no_orchestrator_bypass": true,
    "source_url_first": true,
    "upload_serial": true
  },
  "inputs": {
    "final_article": "../zh_human_writing/final_article.md",
    "final_article_sha256": "b51f06c3bf0726f09aa0d45c4ae172b8a51a8dfab7b95e2363ab77a252dd8386"
  },
  "network_mode": "live",
  "run_id": "20260730T222605-ai-9je33o",
  "skill_name": "media-enrichment",
  "stage": "media_enrichment"
}