{
  "config": {
    "responsibility": "de-AI only; no new facts; freeze article"
  },
  "inputs": {
    "super_writer_article": "../super_writer/article.md"
  },
  "network_mode": "live",
  "run_id": "20260801T231452-vibe-coding-guide-v2-1-1vg6jx",
  "skill_name": "zh-human-writing",
  "stage": "zh_human_writing"
}